{
  "ID": "cnm_p012_q4",
  "Bank": "cn-math",
  "SchemaVersion": "2.0",
  "Year": null,
  "Level": "Primary",
  "Grade": 1,
  "CurriculumUnit": "Grade 1",
  "Batch": "cnm_p012",
  "Number": 4,
  "Area": "Number and algebra",
  "domain": [
    "domain:number-algebra"
  ],
  "skill": [
    "skill:cn:cnm_p012"
  ],
  "Topic": {
    "id": "cnm_p012",
    "label": "Successive Addition and Subtraction"
  },
  "Difficulty": "standard",
  "Language": "en",
  "ResponseType": "numeric",
  "Question Type": "text",
  "Choices Type": "text",
  "Question": "There are 10 cookies. 1 is eaten, then another 4 are eaten. How many are left? Calculate: \\(10-1-4=?\\)",
  "Choices": {},
  "Correct Answer": "5",
  "Accepted Answers": [],
  "Unordered Answers": false,
  "Solution": "\\(10-1=9\\), \\(9-4=5\\).",
  "Meta": {
    "SourceURL": "https://github.com/xiaoyang111222/cn-math-taxonomy",
    "SourceRevision": "62b341d4b66b175413d6e3f697e37639fd96aa2d",
    "SourceQuestionID": "cnm_p012_q4",
    "SourceTopicID": "cnm_p012",
    "SolutionSource": "cn-math-taxonomy (AI-generated; not teacher reviewed)",
    "License": "CC-BY-NC-4.0",
    "LicenseURL": "https://creativecommons.org/licenses/by-nc/4.0/",
    "Attribution": "xiaoyang111222/cn-math-taxonomy contributors",
    "Modifications": [
      "Converted to learning-harness schema",
      "English translation"
    ],
    "Translation": {
      "status": "machine-translated",
      "humanReviewed": false,
      "model": "gpt-6.1-sol (xhigh)"
    },
    "LabelProvenance": "Domain from upstream category; provisional skill from upstream topic, not a formula-level judgment.",
    "Original": {
      "id": "cnm_p012_q4",
      "topicId": "cnm_p012",
      "difficulty": "standard",
      "type": "numeric",
      "prompt": "有 10 块饼干，吃了 1 块，又吃了 4 块。还剩几块？计算：10－1－4＝？",
      "answer": "5",
      "explanation": "10－1＝9，9－4＝5。",
      "verify": "10-1-4"
    },
    "FigureSources": {},
    "Figures": []
  }
}
