{
  "ID": "cnm_h200_q1",
  "Bank": "cn-math",
  "SchemaVersion": "2.0",
  "Year": null,
  "Level": "High school elective",
  "Grade": 13,
  "CurriculumUnit": "Elective mathematics II",
  "Batch": "cnm_h200",
  "Number": 1,
  "Area": "Number and algebra",
  "domain": [
    "domain:number-algebra"
  ],
  "skill": [
    "skill:cn:cnm_h200"
  ],
  "Topic": {
    "id": "cnm_h200",
    "label": "Simple recurrence relations"
  },
  "Difficulty": "basic",
  "Language": "en",
  "ResponseType": "numeric",
  "Question Type": "text",
  "Choices Type": "text",
  "Question": "\\(a_1=3\\) and \\(a_{n+1}=a_n+4\\). What is \\(a_2\\)?",
  "Choices": {},
  "Correct Answer": "7",
  "Accepted Answers": [],
  "Unordered Answers": false,
  "Solution": "Each term is 4 greater than the preceding term, so \\(a_2=7\\).",
  "Meta": {
    "SourceURL": "https://github.com/xiaoyang111222/cn-math-taxonomy",
    "SourceRevision": "62b341d4b66b175413d6e3f697e37639fd96aa2d",
    "SourceQuestionID": "cnm_h200_q1",
    "SourceTopicID": "cnm_h200",
    "SolutionSource": "cn-math-taxonomy (AI-generated; not teacher reviewed)",
    "License": "CC-BY-NC-4.0",
    "LicenseURL": "https://creativecommons.org/licenses/by-nc/4.0/",
    "Attribution": "xiaoyang111222/cn-math-taxonomy contributors",
    "Modifications": [
      "Converted to learning-harness schema",
      "English translation"
    ],
    "Translation": {
      "status": "machine-translated",
      "humanReviewed": false,
      "model": "gpt-6.1-sol (xhigh)"
    },
    "LabelProvenance": "Domain from upstream category; provisional skill from upstream topic, not a formula-level judgment.",
    "Original": {
      "id": "cnm_h200_q1",
      "topicId": "cnm_h200",
      "difficulty": "basic",
      "type": "numeric",
      "prompt": "a_1=3，a_{n+1}=a_n+4。a_2 等于多少？",
      "answer": "7",
      "explanation": "后一项比前一项大 4，a_2=7。",
      "verify": "3+4"
    },
    "FigureSources": {},
    "Figures": []
  }
}
