{
  "ID": "cnm_h100_q4",
  "Bank": "cn-math",
  "SchemaVersion": "2.0",
  "Year": null,
  "Level": "High school required",
  "Grade": 11,
  "CurriculumUnit": "Required mathematics II",
  "Batch": "cnm_h100",
  "Number": 4,
  "Area": "Number and algebra",
  "domain": [
    "domain:number-algebra"
  ],
  "skill": [
    "skill:cn:cnm_h100"
  ],
  "Topic": {
    "id": "cnm_h100",
    "label": "Complex Number Addition and Subtraction"
  },
  "Difficulty": "standard",
  "Language": "en",
  "ResponseType": "numeric",
  "Question Type": "text",
  "Choices Type": "text",
  "Question": "What is the imaginary part of \\((5+i)-(2+3i)\\)?",
  "Choices": {},
  "Correct Answer": "-2",
  "Accepted Answers": [],
  "Unordered Answers": false,
  "Solution": "The imaginary part is \\(1-3=-2\\).",
  "Meta": {
    "SourceURL": "https://github.com/xiaoyang111222/cn-math-taxonomy",
    "SourceRevision": "62b341d4b66b175413d6e3f697e37639fd96aa2d",
    "SourceQuestionID": "cnm_h100_q4",
    "SourceTopicID": "cnm_h100",
    "SolutionSource": "cn-math-taxonomy (AI-generated; not teacher reviewed)",
    "License": "CC-BY-NC-4.0",
    "LicenseURL": "https://creativecommons.org/licenses/by-nc/4.0/",
    "Attribution": "xiaoyang111222/cn-math-taxonomy contributors",
    "Modifications": [
      "Converted to learning-harness schema",
      "English translation"
    ],
    "Translation": {
      "status": "machine-translated",
      "humanReviewed": false,
      "model": "gpt-6.1-sol (xhigh)"
    },
    "LabelProvenance": "Domain from upstream category; provisional skill from upstream topic, not a formula-level judgment.",
    "Original": {
      "id": "cnm_h100_q4",
      "topicId": "cnm_h100",
      "difficulty": "standard",
      "type": "numeric",
      "prompt": "(5+i)−(2+3i) 的虚部是多少？",
      "answer": "-2",
      "explanation": "虚部 1−3=−2。",
      "verify": "1-3"
    },
    "FigureSources": {},
    "Figures": []
  }
}
