{
  "ID": "cnm_137_q2",
  "Bank": "cn-math",
  "SchemaVersion": "2.0",
  "Year": null,
  "Level": "Middle school",
  "Grade": 8,
  "CurriculumUnit": "Grade 8",
  "Batch": "cnm_137",
  "Number": 2,
  "Area": "Geometry",
  "domain": [
    "domain:geometry"
  ],
  "skill": [
    "skill:cn:cnm_137"
  ],
  "Topic": {
    "id": "cnm_137",
    "label": "Properties of Isosceles Triangles"
  },
  "Difficulty": "basic",
  "Language": "en",
  "ResponseType": "choice",
  "Question Type": "text",
  "Choices Type": "text",
  "Question": "In \\(\\triangle ABC\\), \\(AB=AC\\). Which of the following conclusions is correct?",
  "Choices": {
    "A": "\\(\\angle A=\\angle B\\)",
    "B": "\\(\\angle B=\\angle C\\)",
    "C": "\\(\\angle A=\\angle C\\)",
    "D": "\\(BC=AB\\)"
  },
  "Correct Answer": "B",
  "Accepted Answers": [],
  "Unordered Answers": false,
  "Solution": "The two base angles of an isosceles triangle are equal. When \\(AB=AC\\), the base angles are \\(\\angle B\\) and \\(\\angle C\\).",
  "Meta": {
    "SourceURL": "https://github.com/xiaoyang111222/cn-math-taxonomy",
    "SourceRevision": "62b341d4b66b175413d6e3f697e37639fd96aa2d",
    "SourceQuestionID": "cnm_137_q2",
    "SourceTopicID": "cnm_137",
    "SolutionSource": "cn-math-taxonomy (AI-generated; not teacher reviewed)",
    "License": "CC-BY-NC-4.0",
    "LicenseURL": "https://creativecommons.org/licenses/by-nc/4.0/",
    "Attribution": "xiaoyang111222/cn-math-taxonomy contributors",
    "Modifications": [
      "Converted to learning-harness schema",
      "English translation"
    ],
    "Translation": {
      "status": "machine-translated",
      "humanReviewed": false,
      "model": "gpt-6.1-sol (xhigh)"
    },
    "LabelProvenance": "Domain from upstream category; provisional skill from upstream topic, not a formula-level judgment.",
    "Original": {
      "id": "cnm_137_q2",
      "topicId": "cnm_137",
      "difficulty": "basic",
      "type": "choice",
      "prompt": "在 △ABC 中，AB=AC，则下列结论正确的是：",
      "answer": "B",
      "choices": [
        {
          "key": "A",
          "text": "∠A=∠B"
        },
        {
          "key": "B",
          "text": "∠B=∠C"
        },
        {
          "key": "C",
          "text": "∠A=∠C"
        },
        {
          "key": "D",
          "text": "BC=AB"
        }
      ],
      "explanation": "等腰三角形两底角相等，AB=AC 时底角为 ∠B、∠C。"
    },
    "FigureSources": {},
    "Figures": []
  }
}
