{
  "ID": "cnm_081_q1",
  "Bank": "cn-math",
  "SchemaVersion": "2.0",
  "Year": null,
  "Level": "Middle school",
  "Grade": 7,
  "CurriculumUnit": "Grade 7",
  "Batch": "cnm_081",
  "Number": 1,
  "Area": "Geometry",
  "domain": [
    "domain:geometry"
  ],
  "skill": [
    "skill:cn:cnm_081"
  ],
  "Topic": {
    "id": "cnm_081",
    "label": "Ordered Pairs"
  },
  "Difficulty": "basic",
  "Language": "en",
  "ResponseType": "choice",
  "Question Type": "text",
  "Choices Type": "text",
  "Question": "Do the movie ticket labels “row 3, seat 5” and “row 5, seat 3” refer to the same seat?",
  "Choices": {
    "A": "They refer to the same seat.",
    "B": "They refer to different seats.",
    "C": "It cannot be determined."
  },
  "Correct Answer": "B",
  "Accepted Answers": [],
  "Unordered Answers": false,
  "Solution": "“Row 3, seat 5” is the 5th seat in the 3rd row, while “row 5, seat 3” is the 3rd seat in the 5th row. The positions are different, showing that the order of the numbers in a pair cannot be interchanged arbitrarily.",
  "Meta": {
    "SourceURL": "https://github.com/xiaoyang111222/cn-math-taxonomy",
    "SourceRevision": "62b341d4b66b175413d6e3f697e37639fd96aa2d",
    "SourceQuestionID": "cnm_081_q1",
    "SourceTopicID": "cnm_081",
    "SolutionSource": "cn-math-taxonomy (AI-generated; not teacher reviewed)",
    "License": "CC-BY-NC-4.0",
    "LicenseURL": "https://creativecommons.org/licenses/by-nc/4.0/",
    "Attribution": "xiaoyang111222/cn-math-taxonomy contributors",
    "Modifications": [
      "Converted to learning-harness schema",
      "English translation"
    ],
    "Translation": {
      "status": "machine-translated",
      "humanReviewed": false,
      "model": "gpt-6.1-sol (xhigh)"
    },
    "LabelProvenance": "Domain from upstream category; provisional skill from upstream topic, not a formula-level judgment.",
    "Original": {
      "id": "cnm_081_q1",
      "topicId": "cnm_081",
      "difficulty": "basic",
      "type": "choice",
      "prompt": "电影票“3 排 5 号”与“5 排 3 号”相同吗？",
      "choices": [
        {
          "key": "A",
          "text": "相同"
        },
        {
          "key": "B",
          "text": "不同"
        },
        {
          "key": "C",
          "text": "无法判断"
        }
      ],
      "answer": "B",
      "explanation": "3 排 5 号是第 3 排的第 5 个座位，5 排 3 号是第 5 排的第 3 个座位，位置不同，说明数对的顺序不能随意交换。"
    },
    "FigureSources": {},
    "Figures": []
  }
}
