{
  "ID": "cnm_p043_q3",
  "Bank": "cn-math",
  "SchemaVersion": "2.0",
  "Year": null,
  "Level": "Primary",
  "Grade": 2,
  "CurriculumUnit": "Grade 2",
  "Batch": "cnm_p043",
  "Number": 3,
  "Area": "Number and algebra",
  "domain": [
    "domain:number-algebra"
  ],
  "skill": [
    "skill:cn:cnm_p043"
  ],
  "Topic": {
    "id": "cnm_p043",
    "label": "The Meaning of Division"
  },
  "Difficulty": "standard",
  "Language": "en",
  "ResponseType": "numeric",
  "Question Type": "text",
  "Choices Type": "text",
  "Question": "Calculate: \\(8\\div2=?\\)",
  "Choices": {},
  "Correct Answer": "4",
  "Accepted Answers": [],
  "Unordered Answers": false,
  "Solution": "\\(8\\div2=4\\).",
  "Meta": {
    "SourceURL": "https://github.com/xiaoyang111222/cn-math-taxonomy",
    "SourceRevision": "62b341d4b66b175413d6e3f697e37639fd96aa2d",
    "SourceQuestionID": "cnm_p043_q3",
    "SourceTopicID": "cnm_p043",
    "SolutionSource": "cn-math-taxonomy (AI-generated; not teacher reviewed)",
    "License": "CC-BY-NC-4.0",
    "LicenseURL": "https://creativecommons.org/licenses/by-nc/4.0/",
    "Attribution": "xiaoyang111222/cn-math-taxonomy contributors",
    "Modifications": [
      "Converted to learning-harness schema",
      "English translation"
    ],
    "Translation": {
      "status": "machine-translated",
      "humanReviewed": false,
      "model": "gpt-6.1-sol (xhigh)"
    },
    "LabelProvenance": "Domain from upstream category; provisional skill from upstream topic, not a formula-level judgment.",
    "Original": {
      "id": "cnm_p043_q3",
      "topicId": "cnm_p043",
      "difficulty": "standard",
      "type": "numeric",
      "prompt": "计算：8÷2＝？",
      "answer": "4",
      "explanation": "8÷2＝4。",
      "verify": "8/2"
    },
    "FigureSources": {},
    "Figures": []
  }
}
