{
  "ID": "cnm_p172_q4",
  "Bank": "cn-math",
  "SchemaVersion": "2.0",
  "Year": null,
  "Level": "Primary",
  "Grade": 5,
  "CurriculumUnit": "Grade 5",
  "Batch": "cnm_p172",
  "Number": 4,
  "Area": "Number and algebra",
  "domain": [
    "domain:number-algebra"
  ],
  "skill": [
    "skill:cn:cnm_p172"
  ],
  "Topic": {
    "id": "cnm_p172",
    "label": "Converting Fractions to a Common Denominator"
  },
  "Difficulty": "standard",
  "Language": "en",
  "ResponseType": "choice",
  "Question Type": "text",
  "Choices Type": "text",
  "Question": "Which is the result of \\(3 \\times 4\\)?",
  "Choices": {
    "A": "7",
    "B": "12",
    "C": "9",
    "D": "16"
  },
  "Correct Answer": "B",
  "Accepted Answers": [],
  "Unordered Answers": false,
  "Solution": "The least common multiple of 3 and 4 is 12.",
  "Meta": {
    "SourceURL": "https://github.com/xiaoyang111222/cn-math-taxonomy",
    "SourceRevision": "62b341d4b66b175413d6e3f697e37639fd96aa2d",
    "SourceQuestionID": "cnm_p172_q4",
    "SourceTopicID": "cnm_p172",
    "SolutionSource": "cn-math-taxonomy (AI-generated; not teacher reviewed)",
    "License": "CC-BY-NC-4.0",
    "LicenseURL": "https://creativecommons.org/licenses/by-nc/4.0/",
    "Attribution": "xiaoyang111222/cn-math-taxonomy contributors",
    "Modifications": [
      "Converted to learning-harness schema",
      "English translation"
    ],
    "Translation": {
      "status": "machine-translated",
      "humanReviewed": false,
      "model": "gpt-6.1-sol (xhigh)"
    },
    "LabelProvenance": "Domain from upstream category; provisional skill from upstream topic, not a formula-level judgment.",
    "Original": {
      "id": "cnm_p172_q4",
      "topicId": "cnm_p172",
      "difficulty": "standard",
      "type": "choice",
      "prompt": "3×4 的得数是哪一个？",
      "choices": [
        {
          "key": "A",
          "text": "7"
        },
        {
          "key": "B",
          "text": "12"
        },
        {
          "key": "C",
          "text": "9"
        },
        {
          "key": "D",
          "text": "16"
        }
      ],
      "answer": "B",
      "explanation": "3 和 4 的最小公倍数是 12。",
      "verify": "3*4"
    },
    "FigureSources": {},
    "Figures": []
  }
}
