{
  "ID": "cnm_197_q4",
  "Bank": "cn-math",
  "SchemaVersion": "2.0",
  "Year": null,
  "Level": "Middle school",
  "Grade": 8,
  "CurriculumUnit": "Grade 8",
  "Batch": "cnm_197",
  "Number": 4,
  "Area": "Number and algebra",
  "domain": [
    "domain:number-algebra"
  ],
  "skill": [
    "skill:cn:cnm_197"
  ],
  "Topic": {
    "id": "cnm_197",
    "label": "Graphs of Functions"
  },
  "Difficulty": "standard",
  "Language": "en",
  "ResponseType": "choice",
  "Question Type": "text",
  "Choices Type": "text",
  "Question": "Xiaoming leaves home for school. The graph of distance \\(s\\) as a function of time \\(t\\) contains a line segment parallel to the \\(t\\)-axis. This segment represents:",
  "Choices": {
    "A": "Moving forward at a constant speed",
    "B": "Moving forward at an increasing speed",
    "C": "Returning home",
    "D": "Staying still"
  },
  "Correct Answer": "D",
  "Accepted Answers": [],
  "Unordered Answers": false,
  "Solution": "The line segment is parallel to the \\(t\\)-axis, indicating that time increases while distance \\(s\\) remains unchanged, so he stays still.",
  "Meta": {
    "SourceURL": "https://github.com/xiaoyang111222/cn-math-taxonomy",
    "SourceRevision": "62b341d4b66b175413d6e3f697e37639fd96aa2d",
    "SourceQuestionID": "cnm_197_q4",
    "SourceTopicID": "cnm_197",
    "SolutionSource": "cn-math-taxonomy (AI-generated; not teacher reviewed)",
    "License": "CC-BY-NC-4.0",
    "LicenseURL": "https://creativecommons.org/licenses/by-nc/4.0/",
    "Attribution": "xiaoyang111222/cn-math-taxonomy contributors",
    "Modifications": [
      "Converted to learning-harness schema",
      "English translation"
    ],
    "Translation": {
      "status": "machine-translated",
      "humanReviewed": false,
      "model": "gpt-6.1-sol (xhigh)"
    },
    "LabelProvenance": "Domain from upstream category; provisional skill from upstream topic, not a formula-level judgment.",
    "Original": {
      "id": "cnm_197_q4",
      "topicId": "cnm_197",
      "difficulty": "standard",
      "type": "choice",
      "prompt": "小明从家出发去学校，路程 s 与时间 t 的函数图象中有一段平行于 t 轴的线段，这一段表示：",
      "choices": [
        {
          "key": "A",
          "text": "匀速前进"
        },
        {
          "key": "B",
          "text": "加速前进"
        },
        {
          "key": "C",
          "text": "返回家中"
        },
        {
          "key": "D",
          "text": "停留不动"
        }
      ],
      "answer": "D",
      "explanation": "线段平行于 t 轴，说明时间在增加而路程 s 不变，即停留不动。"
    },
    "FigureSources": {},
    "Figures": []
  }
}
