{
  "ID": "cnm_201_q1",
  "Bank": "cn-math",
  "SchemaVersion": "2.0",
  "Year": null,
  "Level": "Middle school",
  "Grade": 8,
  "CurriculumUnit": "Grade 8",
  "Batch": "cnm_201",
  "Number": 1,
  "Area": "Number and algebra",
  "domain": [
    "domain:number-algebra"
  ],
  "skill": [
    "skill:cn:cnm_201"
  ],
  "Topic": {
    "id": "cnm_201",
    "label": "The Concept of a Linear Function"
  },
  "Difficulty": "basic",
  "Language": "en",
  "ResponseType": "short",
  "Question Type": "text",
  "Choices Type": "text",
  "Question": "If \\(y=(m-1)x+2\\) is a linear function, what condition must \\(m\\) satisfy?",
  "Choices": {},
  "Correct Answer": "m≠1",
  "Accepted Answers": [
    "m≠1",
    "m is not equal to 1",
    "m ≠ 1"
  ],
  "Unordered Answers": false,
  "Solution": "A linear function \\(y=kx+b\\) requires \\(k\\ne0\\), so \\(m-1\\ne0\\), or \\(m\\ne1\\).",
  "Meta": {
    "SourceURL": "https://github.com/xiaoyang111222/cn-math-taxonomy",
    "SourceRevision": "62b341d4b66b175413d6e3f697e37639fd96aa2d",
    "SourceQuestionID": "cnm_201_q1",
    "SourceTopicID": "cnm_201",
    "SolutionSource": "cn-math-taxonomy (AI-generated; not teacher reviewed)",
    "License": "CC-BY-NC-4.0",
    "LicenseURL": "https://creativecommons.org/licenses/by-nc/4.0/",
    "Attribution": "xiaoyang111222/cn-math-taxonomy contributors",
    "Modifications": [
      "Converted to learning-harness schema",
      "English translation"
    ],
    "Translation": {
      "status": "machine-translated",
      "humanReviewed": false,
      "model": "gpt-6.1-sol (xhigh)"
    },
    "LabelProvenance": "Domain from upstream category; provisional skill from upstream topic, not a formula-level judgment.",
    "Original": {
      "id": "cnm_201_q1",
      "topicId": "cnm_201",
      "difficulty": "basic",
      "type": "short",
      "prompt": "y=(m-1)x+2 是一次函数，m 应满足什么？",
      "answer": "m≠1",
      "accept": [
        "m≠1",
        "m不等于1",
        "m ≠ 1"
      ],
      "explanation": "一次函数 y=kx+b 要求 k≠0，所以 m-1≠0，即 m≠1。"
    },
    "FigureSources": {},
    "Figures": []
  }
}
