{
  "ID": "cnm_h122_q4",
  "Bank": "cn-math",
  "SchemaVersion": "2.0",
  "Year": null,
  "Level": "High school required",
  "Grade": 11,
  "CurriculumUnit": "Required mathematics II",
  "Batch": "cnm_h122",
  "Number": 4,
  "Area": "Geometry",
  "domain": [
    "domain:geometry"
  ],
  "skill": [
    "skill:cn:cnm_h122"
  ],
  "Topic": {
    "id": "cnm_h122",
    "label": "Perpendicular Planes"
  },
  "Difficulty": "standard",
  "Language": "en",
  "ResponseType": "choice",
  "Question Type": "text",
  "Choices Type": "text",
  "Question": "How are a wall and a floor usually modeled geometrically?",
  "Choices": {
    "A": "Two parallel planes",
    "B": "Two skew lines",
    "C": "Two mutually perpendicular planes",
    "D": "A spherical surface"
  },
  "Correct Answer": "C",
  "Accepted Answers": [],
  "Unordered Answers": false,
  "Solution": "The wall and the floor intersect along the foot of the wall, and the wall contains a line perpendicular to the floor.",
  "Meta": {
    "SourceURL": "https://github.com/xiaoyang111222/cn-math-taxonomy",
    "SourceRevision": "62b341d4b66b175413d6e3f697e37639fd96aa2d",
    "SourceQuestionID": "cnm_h122_q4",
    "SourceTopicID": "cnm_h122",
    "SolutionSource": "cn-math-taxonomy (AI-generated; not teacher reviewed)",
    "License": "CC-BY-NC-4.0",
    "LicenseURL": "https://creativecommons.org/licenses/by-nc/4.0/",
    "Attribution": "xiaoyang111222/cn-math-taxonomy contributors",
    "Modifications": [
      "Converted to learning-harness schema",
      "English translation"
    ],
    "Translation": {
      "status": "machine-translated",
      "humanReviewed": false,
      "model": "gpt-6.1-sol (xhigh)"
    },
    "LabelProvenance": "Domain from upstream category; provisional skill from upstream topic, not a formula-level judgment.",
    "Original": {
      "id": "cnm_h122_q4",
      "topicId": "cnm_h122",
      "difficulty": "standard",
      "type": "choice",
      "prompt": "墙面与地面通常抽象成？",
      "choices": [
        {
          "key": "A",
          "text": "两个平行平面"
        },
        {
          "key": "B",
          "text": "两条异面直线"
        },
        {
          "key": "C",
          "text": "两个互相垂直的平面"
        },
        {
          "key": "D",
          "text": "一个球面"
        }
      ],
      "answer": "C",
      "explanation": "墙面和地面的交线是墙脚，墙面过地面的垂线。",
      "verify": "\"两个互相垂直的平面\""
    },
    "FigureSources": {},
    "Figures": []
  }
}
