{
  "ID": "cnm_122_q5",
  "Bank": "cn-math",
  "SchemaVersion": "2.0",
  "Year": null,
  "Level": "Middle school",
  "Grade": 8,
  "CurriculumUnit": "Grade 8",
  "Batch": "cnm_122",
  "Number": 5,
  "Area": "Geometry",
  "domain": [
    "domain:geometry"
  ],
  "skill": [
    "skill:cn:cnm_122"
  ],
  "Topic": {
    "id": "cnm_122",
    "label": "Congruence Criterion: Side-Side-Side (SSS)"
  },
  "Difficulty": "advanced",
  "Language": "en",
  "ResponseType": "numeric",
  "Question Type": "text",
  "Choices Type": "text",
  "Question": "In quadrilateral \\(ABCD\\), \\(AB=CD\\), \\(AD=CB\\), and \\(\\angle B=70^\\circ\\). Find the measure of \\(\\angle D\\) in degrees.",
  "Choices": {},
  "Correct Answer": "70",
  "Accepted Answers": [],
  "Unordered Answers": false,
  "Solution": "Draw \\(AC\\). By SSS, \\(\\triangle ABC\\cong\\triangle CDA\\). The corresponding angles \\(\\angle B\\) and \\(\\angle D\\) are equal, so \\(\\angle D=70^\\circ\\).",
  "Meta": {
    "SourceURL": "https://github.com/xiaoyang111222/cn-math-taxonomy",
    "SourceRevision": "62b341d4b66b175413d6e3f697e37639fd96aa2d",
    "SourceQuestionID": "cnm_122_q5",
    "SourceTopicID": "cnm_122",
    "SolutionSource": "cn-math-taxonomy (AI-generated; not teacher reviewed)",
    "License": "CC-BY-NC-4.0",
    "LicenseURL": "https://creativecommons.org/licenses/by-nc/4.0/",
    "Attribution": "xiaoyang111222/cn-math-taxonomy contributors",
    "Modifications": [
      "Converted to learning-harness schema",
      "English translation"
    ],
    "Translation": {
      "status": "machine-translated",
      "humanReviewed": false,
      "model": "gpt-6.1-sol (xhigh)"
    },
    "LabelProvenance": "Domain from upstream category; provisional skill from upstream topic, not a formula-level judgment.",
    "Original": {
      "id": "cnm_122_q5",
      "topicId": "cnm_122",
      "difficulty": "advanced",
      "type": "numeric",
      "prompt": "四边形 ABCD 中，AB=CD，AD=CB，∠B=70°，求 ∠D 的度数。",
      "answer": "70",
      "explanation": "连接 AC，由 SSS 得 △ABC≌△CDA，对应角 ∠B 与 ∠D 相等，所以 ∠D=70°。"
    },
    "FigureSources": {},
    "Figures": []
  }
}
