{
  "ID": "cnm_p153_q2",
  "Bank": "cn-math",
  "SchemaVersion": "2.0",
  "Year": null,
  "Level": "Primary",
  "Grade": 5,
  "CurriculumUnit": "Grade 5",
  "Batch": "cnm_p153",
  "Number": 2,
  "Area": "Number and algebra",
  "domain": [
    "domain:number-algebra"
  ],
  "skill": [
    "skill:cn:cnm_p153"
  ],
  "Topic": {
    "id": "cnm_p153",
    "label": "Factors and multiples"
  },
  "Difficulty": "basic",
  "Language": "en",
  "ResponseType": "numeric",
  "Question Type": "text",
  "Choices Type": "text",
  "Question": "Calculate: \\(6\\times 4=?\\)",
  "Choices": {},
  "Correct Answer": "24",
  "Accepted Answers": [],
  "Unordered Answers": false,
  "Solution": "\\(6\\times 4=24\\), and 24 is a multiple of 6.",
  "Meta": {
    "SourceURL": "https://github.com/xiaoyang111222/cn-math-taxonomy",
    "SourceRevision": "62b341d4b66b175413d6e3f697e37639fd96aa2d",
    "SourceQuestionID": "cnm_p153_q2",
    "SourceTopicID": "cnm_p153",
    "SolutionSource": "cn-math-taxonomy (AI-generated; not teacher reviewed)",
    "License": "CC-BY-NC-4.0",
    "LicenseURL": "https://creativecommons.org/licenses/by-nc/4.0/",
    "Attribution": "xiaoyang111222/cn-math-taxonomy contributors",
    "Modifications": [
      "Converted to learning-harness schema",
      "English translation"
    ],
    "Translation": {
      "status": "machine-translated",
      "humanReviewed": false,
      "model": "gpt-6.1-sol (xhigh)"
    },
    "LabelProvenance": "Domain from upstream category; provisional skill from upstream topic, not a formula-level judgment.",
    "Original": {
      "id": "cnm_p153_q2",
      "topicId": "cnm_p153",
      "difficulty": "basic",
      "type": "numeric",
      "prompt": "计算：6×4＝？",
      "answer": "24",
      "explanation": "6×4＝24，24 是 6 的倍数。",
      "verify": "6*4"
    },
    "FigureSources": {},
    "Figures": []
  }
}
