{
  "ID": "cnm_190_q2",
  "Bank": "cn-math",
  "SchemaVersion": "2.0",
  "Year": null,
  "Level": "Middle school",
  "Grade": 8,
  "CurriculumUnit": "Grade 8",
  "Batch": "cnm_190",
  "Number": 2,
  "Area": "Geometry",
  "domain": [
    "domain:geometry"
  ],
  "skill": [
    "skill:cn:cnm_190"
  ],
  "Topic": {
    "id": "cnm_190",
    "label": "Criteria for a Rhombus"
  },
  "Difficulty": "basic",
  "Language": "en",
  "ResponseType": "choice",
  "Question Type": "text",
  "Choices Type": "text",
  "Question": "Which of the following conditions establishes that parallelogram \\(ABCD\\) is a rhombus?",
  "Choices": {
    "A": "\\(AC=BD\\)",
    "B": "\\(\\angle A=90^\\circ\\)",
    "C": "\\(AB\\parallel CD\\)",
    "D": "\\(AB=BC\\)"
  },
  "Correct Answer": "D",
  "Accepted Answers": [],
  "Unordered Answers": false,
  "Solution": "A parallelogram with a pair of equal adjacent sides is a rhombus. Either \\(AC=BD\\) or \\(\\angle A=90^\\circ\\) establishes that it is a rectangle, while \\(AB\\parallel CD\\) is already a property of a parallelogram.",
  "Meta": {
    "SourceURL": "https://github.com/xiaoyang111222/cn-math-taxonomy",
    "SourceRevision": "62b341d4b66b175413d6e3f697e37639fd96aa2d",
    "SourceQuestionID": "cnm_190_q2",
    "SourceTopicID": "cnm_190",
    "SolutionSource": "cn-math-taxonomy (AI-generated; not teacher reviewed)",
    "License": "CC-BY-NC-4.0",
    "LicenseURL": "https://creativecommons.org/licenses/by-nc/4.0/",
    "Attribution": "xiaoyang111222/cn-math-taxonomy contributors",
    "Modifications": [
      "Converted to learning-harness schema",
      "English translation"
    ],
    "Translation": {
      "status": "machine-translated",
      "humanReviewed": false,
      "model": "gpt-6.1-sol (xhigh)"
    },
    "LabelProvenance": "Domain from upstream category; provisional skill from upstream topic, not a formula-level judgment.",
    "Original": {
      "id": "cnm_190_q2",
      "topicId": "cnm_190",
      "difficulty": "basic",
      "type": "choice",
      "prompt": "下列条件中，能判定平行四边形 ABCD 是菱形的是：",
      "choices": [
        {
          "key": "A",
          "text": "AC=BD"
        },
        {
          "key": "B",
          "text": "∠A=90°"
        },
        {
          "key": "C",
          "text": "AB∥CD"
        },
        {
          "key": "D",
          "text": "AB=BC"
        }
      ],
      "answer": "D",
      "explanation": "一组邻边相等的平行四边形是菱形；AC=BD 或 ∠A=90° 判定的是矩形，AB∥CD 是平行四边形本来就有的性质。"
    },
    "FigureSources": {},
    "Figures": []
  }
}
