{
  "ID": "cnm_h162_q3",
  "Bank": "cn-math",
  "SchemaVersion": "2.0",
  "Year": null,
  "Level": "High school elective",
  "Grade": 12,
  "CurriculumUnit": "Elective mathematics I",
  "Batch": "cnm_h162",
  "Number": 3,
  "Area": "Geometry",
  "domain": [
    "domain:geometry"
  ],
  "skill": [
    "skill:cn:cnm_h162"
  ],
  "Topic": {
    "id": "cnm_h162",
    "label": "Dihedral Angles"
  },
  "Difficulty": "standard",
  "Language": "en",
  "ResponseType": "numeric",
  "Question Type": "text",
  "Choices Type": "text",
  "Question": "\\(n_1=(0,0,1)\\) and \\(n_2=(0,0,5)\\). What is \\(n_1\\cdot n_2\\)?",
  "Choices": {},
  "Correct Answer": "5",
  "Accepted Answers": [],
  "Unordered Answers": false,
  "Solution": "\\(0+0+1\\times5=5\\). Both normal vectors lie along the \\(z\\)-axis and point in the same direction.",
  "Meta": {
    "SourceURL": "https://github.com/xiaoyang111222/cn-math-taxonomy",
    "SourceRevision": "62b341d4b66b175413d6e3f697e37639fd96aa2d",
    "SourceQuestionID": "cnm_h162_q3",
    "SourceTopicID": "cnm_h162",
    "SolutionSource": "cn-math-taxonomy (AI-generated; not teacher reviewed)",
    "License": "CC-BY-NC-4.0",
    "LicenseURL": "https://creativecommons.org/licenses/by-nc/4.0/",
    "Attribution": "xiaoyang111222/cn-math-taxonomy contributors",
    "Modifications": [
      "Converted to learning-harness schema",
      "English translation"
    ],
    "Translation": {
      "status": "machine-translated",
      "humanReviewed": false,
      "model": "gpt-6.1-sol (xhigh)"
    },
    "LabelProvenance": "Domain from upstream category; provisional skill from upstream topic, not a formula-level judgment.",
    "Original": {
      "id": "cnm_h162_q3",
      "topicId": "cnm_h162",
      "difficulty": "standard",
      "type": "numeric",
      "prompt": "n1=(0，0，1)，n2=(0，0，5)。n1·n2 等于多少？",
      "answer": "5",
      "explanation": "0+0+1×5=5。两个法向量都沿 z 轴，方向相同。",
      "verify": "5"
    },
    "FigureSources": {},
    "Figures": []
  }
}
