{
  "ID": "cnm_111_q3",
  "Bank": "cn-math",
  "SchemaVersion": "2.0",
  "Year": null,
  "Level": "Middle school",
  "Grade": 8,
  "CurriculumUnit": "Grade 8",
  "Batch": "cnm_111",
  "Number": 3,
  "Area": "Geometry",
  "domain": [
    "domain:geometry"
  ],
  "skill": [
    "skill:cn:cnm_111"
  ],
  "Topic": {
    "id": "cnm_111",
    "label": "Relationships Among the Three Sides of a Triangle"
  },
  "Difficulty": "standard",
  "Language": "en",
  "ResponseType": "numeric",
  "Question Type": "text",
  "Choices Type": "text",
  "Question": "Two sides of a triangle have lengths 5 and 9. If the third side has an integer length, what is its greatest possible length?",
  "Choices": {},
  "Correct Answer": "13",
  "Accepted Answers": [],
  "Unordered Answers": false,
  "Solution": "The third side \\(x\\) satisfies \\(9-5<x<9+5\\), or \\(4<x<14\\). The greatest integer is 13.",
  "Meta": {
    "SourceURL": "https://github.com/xiaoyang111222/cn-math-taxonomy",
    "SourceRevision": "62b341d4b66b175413d6e3f697e37639fd96aa2d",
    "SourceQuestionID": "cnm_111_q3",
    "SourceTopicID": "cnm_111",
    "SolutionSource": "cn-math-taxonomy (AI-generated; not teacher reviewed)",
    "License": "CC-BY-NC-4.0",
    "LicenseURL": "https://creativecommons.org/licenses/by-nc/4.0/",
    "Attribution": "xiaoyang111222/cn-math-taxonomy contributors",
    "Modifications": [
      "Converted to learning-harness schema",
      "English translation"
    ],
    "Translation": {
      "status": "machine-translated",
      "humanReviewed": false,
      "model": "gpt-6.1-sol (xhigh)"
    },
    "LabelProvenance": "Domain from upstream category; provisional skill from upstream topic, not a formula-level judgment.",
    "Original": {
      "id": "cnm_111_q3",
      "topicId": "cnm_111",
      "difficulty": "standard",
      "type": "numeric",
      "prompt": "三角形的两边长分别为 5 和 9，第三边长为整数，则第三边最大是多少？",
      "answer": "13",
      "explanation": "第三边 x 满足 9-5<x<9+5，即 4<x<14，整数最大为 13。",
      "verify": "5+9-1"
    },
    "FigureSources": {},
    "Figures": []
  }
}
