{
  "ID": "cnm_h052_q4",
  "Bank": "cn-math",
  "SchemaVersion": "2.0",
  "Year": null,
  "Level": "High school required",
  "Grade": 10,
  "CurriculumUnit": "Required mathematics I",
  "Batch": "cnm_h052",
  "Number": 4,
  "Area": "Number and algebra",
  "domain": [
    "domain:number-algebra"
  ],
  "skill": [
    "skill:cn:cnm_h052"
  ],
  "Topic": {
    "id": "cnm_h052",
    "label": "Fitting and Prediction with Function Models"
  },
  "Difficulty": "standard",
  "Language": "en",
  "ResponseType": "choice",
  "Question Type": "text",
  "Choices Type": "text",
  "Question": "After making a prediction using a function model, what else should be done?",
  "Choices": {
    "A": "Use new actual data to test whether the model is suitable",
    "B": "Treat the calculated result as an absolute fact",
    "C": "Change all data that do not fit",
    "D": "Stop collecting data"
  },
  "Correct Answer": "A",
  "Accepted Answers": [],
  "Unordered Answers": false,
  "Solution": "A model is an approximation. Predictions must be tested, and the model should be revised if it is unsuitable.",
  "Meta": {
    "SourceURL": "https://github.com/xiaoyang111222/cn-math-taxonomy",
    "SourceRevision": "62b341d4b66b175413d6e3f697e37639fd96aa2d",
    "SourceQuestionID": "cnm_h052_q4",
    "SourceTopicID": "cnm_h052",
    "SolutionSource": "cn-math-taxonomy (AI-generated; not teacher reviewed)",
    "License": "CC-BY-NC-4.0",
    "LicenseURL": "https://creativecommons.org/licenses/by-nc/4.0/",
    "Attribution": "xiaoyang111222/cn-math-taxonomy contributors",
    "Modifications": [
      "Converted to learning-harness schema",
      "English translation"
    ],
    "Translation": {
      "status": "machine-translated",
      "humanReviewed": false,
      "model": "gpt-6.1-sol (xhigh)"
    },
    "LabelProvenance": "Domain from upstream category; provisional skill from upstream topic, not a formula-level judgment.",
    "Original": {
      "id": "cnm_h052_q4",
      "topicId": "cnm_h052",
      "difficulty": "standard",
      "type": "choice",
      "prompt": "用函数模型预测之后，还应该？",
      "choices": [
        {
          "key": "A",
          "text": "用新的实际数据检验模型是否合适"
        },
        {
          "key": "B",
          "text": "把计算结果当成绝对事实"
        },
        {
          "key": "C",
          "text": "改掉所有不符合的数据"
        },
        {
          "key": "D",
          "text": "不再收集数据"
        }
      ],
      "answer": "A",
      "explanation": "模型是近似。预测要接受检验，不合适就修改模型。",
      "verify": "\"用新的实际数据检验模型是否合适\""
    },
    "FigureSources": {},
    "Figures": []
  }
}
