{
  "ID": "cnm_186_q3",
  "Bank": "cn-math",
  "SchemaVersion": "2.0",
  "Year": null,
  "Level": "Middle school",
  "Grade": 8,
  "CurriculumUnit": "Grade 8",
  "Batch": "cnm_186",
  "Number": 3,
  "Area": "Geometry",
  "domain": [
    "domain:geometry"
  ],
  "skill": [
    "skill:cn:cnm_186"
  ],
  "Topic": {
    "id": "cnm_186",
    "label": "Properties of Rectangles"
  },
  "Difficulty": "standard",
  "Language": "en",
  "ResponseType": "numeric",
  "Question Type": "text",
  "Choices Type": "text",
  "Question": "The diagonals \\(AC\\) and \\(BD\\) of rectangle \\(ABCD\\) intersect at \\(O\\). Given \\(\\angle AOB=60^\\circ\\) and \\(AC=8\\), find the length of \\(AB\\).",
  "Choices": {},
  "Correct Answer": "4",
  "Accepted Answers": [],
  "Unordered Answers": false,
  "Solution": "The diagonals are equal in length and bisect each other, so \\(OA=OB=4\\). Since \\(\\angle AOB=60^\\circ\\), \\(\\triangle AOB\\) is equilateral, and \\(AB=4\\).",
  "Meta": {
    "SourceURL": "https://github.com/xiaoyang111222/cn-math-taxonomy",
    "SourceRevision": "62b341d4b66b175413d6e3f697e37639fd96aa2d",
    "SourceQuestionID": "cnm_186_q3",
    "SourceTopicID": "cnm_186",
    "SolutionSource": "cn-math-taxonomy (AI-generated; not teacher reviewed)",
    "License": "CC-BY-NC-4.0",
    "LicenseURL": "https://creativecommons.org/licenses/by-nc/4.0/",
    "Attribution": "xiaoyang111222/cn-math-taxonomy contributors",
    "Modifications": [
      "Converted to learning-harness schema",
      "English translation"
    ],
    "Translation": {
      "status": "machine-translated",
      "humanReviewed": false,
      "model": "gpt-6.1-sol (xhigh)"
    },
    "LabelProvenance": "Domain from upstream category; provisional skill from upstream topic, not a formula-level judgment.",
    "Original": {
      "id": "cnm_186_q3",
      "topicId": "cnm_186",
      "difficulty": "standard",
      "type": "numeric",
      "prompt": "矩形 ABCD 的对角线 AC、BD 相交于点 O，∠AOB=60°，AC=8，求 AB 的长。",
      "answer": "4",
      "explanation": "对角线相等且互相平分，OA=OB=4，又 ∠AOB=60°，△AOB 是等边三角形，AB=4。",
      "verify": "8//2"
    },
    "FigureSources": {},
    "Figures": []
  }
}
