{
  "ID": "cnm_h105_q4",
  "Bank": "cn-math",
  "SchemaVersion": "2.0",
  "Year": null,
  "Level": "High school required",
  "Grade": 11,
  "CurriculumUnit": "Required mathematics II",
  "Batch": "cnm_h105",
  "Number": 4,
  "Area": "Geometry",
  "domain": [
    "domain:geometry"
  ],
  "skill": [
    "skill:cn:cnm_h105"
  ],
  "Topic": {
    "id": "cnm_h105",
    "label": "Structure of Prisms"
  },
  "Difficulty": "standard",
  "Language": "en",
  "ResponseType": "choice",
  "Question Type": "mixed",
  "Choices Type": "text",
  "Question": "The two bases of a prism are:\n\n[Figure 1](figures/cnm_h105_q4_question_en.svg)",
  "Choices": {
    "A": "Always perpendicular",
    "B": "Parallel to each other and congruent",
    "C": "Always rectangles",
    "D": "Possibly not parallel"
  },
  "Correct Answer": "B",
  "Accepted Answers": [],
  "Unordered Answers": false,
  "Solution": "The lateral edges of a prism connect two congruent, parallel bases. The lateral edges of a right prism are also perpendicular to the bases.",
  "Meta": {
    "SourceURL": "https://github.com/xiaoyang111222/cn-math-taxonomy",
    "SourceRevision": "62b341d4b66b175413d6e3f697e37639fd96aa2d",
    "SourceQuestionID": "cnm_h105_q4",
    "SourceTopicID": "cnm_h105",
    "SolutionSource": "cn-math-taxonomy (AI-generated; not teacher reviewed)",
    "License": "CC-BY-NC-4.0",
    "LicenseURL": "https://creativecommons.org/licenses/by-nc/4.0/",
    "Attribution": "xiaoyang111222/cn-math-taxonomy contributors",
    "Modifications": [
      "Converted to learning-harness schema",
      "English translation",
      "Extracted upstream SVG figures; English labels translated and spaced, viewBox padded; diagram geometry unchanged"
    ],
    "Translation": {
      "status": "machine-translated",
      "humanReviewed": false,
      "model": "gpt-6.1-sol (xhigh)"
    },
    "LabelProvenance": "Domain from upstream category; provisional skill from upstream topic, not a formula-level judgment.",
    "Original": {
      "id": "cnm_h105_q4",
      "topicId": "cnm_h105",
      "difficulty": "standard",
      "type": "choice",
      "prompt": "棱柱的两个底面？",
      "choices": [
        {
          "key": "A",
          "text": "一定垂直"
        },
        {
          "key": "B",
          "text": "互相平行并且全等"
        },
        {
          "key": "C",
          "text": "一定是矩形"
        },
        {
          "key": "D",
          "text": "可以不平行"
        }
      ],
      "answer": "B",
      "explanation": "棱柱的侧棱把两个全等的底面平行地连起来。直棱柱的侧棱还垂直于底面。",
      "verify": "\"互相平行并且全等\"",
      "figure": "<svg xmlns=\"http://www.w3.org/2000/svg\" viewBox=\"0 0 220 234\"><polygon points=\"152.8,102 75.2,102 51.2,55 114,26 176.8,55\" fill=\"currentColor\" fill-opacity=\"0.18\" stroke=\"none\"/><polygon points=\"152.8,102 75.2,102 75.2,198 152.8,198\" fill=\"currentColor\" fill-opacity=\"0.10\" stroke=\"none\"/><polygon points=\"75.2,102 51.2,55 51.2,151 75.2,198\" fill=\"currentColor\" fill-opacity=\"0.10\" stroke=\"none\"/><polygon points=\"176.8,55 152.8,102 152.8,198 176.8,151\" fill=\"currentColor\" fill-opacity=\"0.10\" stroke=\"none\"/><line x1=\"114\" y1=\"26\" x2=\"114\" y2=\"122\" fill=\"none\" stroke=\"currentColor\" stroke-width=\"2.6\" stroke-dasharray=\"7 5\" stroke-linejoin=\"round\" stroke-linecap=\"round\"/><line x1=\"51.2\" y1=\"151\" x2=\"114\" y2=\"122\" fill=\"none\" stroke=\"currentColor\" stroke-width=\"2.6\" stroke-dasharray=\"7 5\" stroke-linejoin=\"round\" stroke-linecap=\"round\"/><line x1=\"114\" y1=\"122\" x2=\"176.8\" y2=\"151\" fill=\"none\" stroke=\"currentColor\" stroke-width=\"2.6\" stroke-dasharray=\"7 5\" stroke-linejoin=\"round\" stroke-linecap=\"round\"/><line x1=\"152.8\" y1=\"102\" x2=\"75.2\" y2=\"102\" fill=\"none\" stroke=\"currentColor\" stroke-width=\"2.6\" stroke-linejoin=\"round\" stroke-linecap=\"round\"/><line x1=\"75.2\" y1=\"102\" x2=\"51.2\" y2=\"55\" fill=\"none\" stroke=\"currentColor\" stroke-width=\"2.6\" stroke-linejoin=\"round\" stroke-linecap=\"round\"/><line x1=\"51.2\" y1=\"55\" x2=\"114\" y2=\"26\" fill=\"none\" stroke=\"currentColor\" stroke-width=\"2.6\" stroke-linejoin=\"round\" stroke-linecap=\"round\"/><line x1=\"114\" y1=\"26\" x2=\"176.8\" y2=\"55\" fill=\"none\" stroke=\"currentColor\" stroke-width=\"2.6\" stroke-linejoin=\"round\" stroke-linecap=\"round\"/><line x1=\"176.8\" y1=\"55\" x2=\"152.8\" y2=\"102\" fill=\"none\" stroke=\"currentColor\" stroke-width=\"2.6\" stroke-linejoin=\"round\" stroke-linecap=\"round\"/><line x1=\"152.8\" y1=\"102\" x2=\"152.8\" y2=\"198\" fill=\"none\" stroke=\"currentColor\" stroke-width=\"2.6\" stroke-linejoin=\"round\" stroke-linecap=\"round\"/><line x1=\"75.2\" y1=\"102\" x2=\"75.2\" y2=\"198\" fill=\"none\" stroke=\"currentColor\" stroke-width=\"2.6\" stroke-linejoin=\"round\" stroke-linecap=\"round\"/><line x1=\"51.2\" y1=\"55\" x2=\"51.2\" y2=\"151\" fill=\"none\" stroke=\"currentColor\" stroke-width=\"2.6\" stroke-linejoin=\"round\" stroke-linecap=\"round\"/><line x1=\"176.8\" y1=\"55\" x2=\"176.8\" y2=\"151\" fill=\"none\" stroke=\"currentColor\" stroke-width=\"2.6\" stroke-linejoin=\"round\" stroke-linecap=\"round\"/><line x1=\"152.8\" y1=\"198\" x2=\"75.2\" y2=\"198\" fill=\"none\" stroke=\"currentColor\" stroke-width=\"2.6\" stroke-linejoin=\"round\" stroke-linecap=\"round\"/><line x1=\"75.2\" y1=\"198\" x2=\"51.2\" y2=\"151\" fill=\"none\" stroke=\"currentColor\" stroke-width=\"2.6\" stroke-linejoin=\"round\" stroke-linecap=\"round\"/><line x1=\"176.8\" y1=\"151\" x2=\"152.8\" y2=\"198\" fill=\"none\" stroke=\"currentColor\" stroke-width=\"2.6\" stroke-linejoin=\"round\" stroke-linecap=\"round\"/></svg>"
    },
    "FigureSources": {
      "figures/cnm_h105_q4_question_en.svg": {
        "url": "https://github.com/xiaoyang111222/cn-math-taxonomy/blob/62b341d4b66b175413d6e3f697e37639fd96aa2d/data/questions.json",
        "sourceQuestionID": "cnm_h105_q4",
        "sourcePointer": "/figure",
        "alt": "Structure of Prisms",
        "originalSHA256": "c9e7161b323e99dcc59e7a79012d122fb57162fe9186d376461a6bb4cdba9966",
        "sha256": "2a5d6213976334d6c2360f6c5df17c7da6655cb83ebc2454e0aae5cb675b0f96",
        "translatedLabels": {},
        "labelLayout": {},
        "viewBoxPadding": 24,
        "geometry": "Unchanged upstream SVG geometry"
      }
    },
    "Figures": [
      "figures/cnm_h105_q4_question_en.svg"
    ]
  }
}
