{
  "ID": "cnm_h114_q3",
  "Bank": "cn-math",
  "SchemaVersion": "2.0",
  "Year": null,
  "Level": "High school required",
  "Grade": 11,
  "CurriculumUnit": "Required mathematics II",
  "Batch": "cnm_h114",
  "Number": 3,
  "Area": "Geometry",
  "domain": [
    "domain:geometry"
  ],
  "skill": [
    "skill:cn:cnm_h114"
  ],
  "Topic": {
    "id": "cnm_h114",
    "label": "Relative positions of lines in space"
  },
  "Difficulty": "standard",
  "Language": "en",
  "ResponseType": "numeric",
  "Question Type": "text",
  "Choices Type": "text",
  "Question": "How many intersection points do two intersecting lines in space have?",
  "Choices": {},
  "Correct Answer": "1",
  "Accepted Answers": [],
  "Unordered Answers": false,
  "Solution": "Intersecting means having one and only one common point.",
  "Meta": {
    "SourceURL": "https://github.com/xiaoyang111222/cn-math-taxonomy",
    "SourceRevision": "62b341d4b66b175413d6e3f697e37639fd96aa2d",
    "SourceQuestionID": "cnm_h114_q3",
    "SourceTopicID": "cnm_h114",
    "SolutionSource": "cn-math-taxonomy (AI-generated; not teacher reviewed)",
    "License": "CC-BY-NC-4.0",
    "LicenseURL": "https://creativecommons.org/licenses/by-nc/4.0/",
    "Attribution": "xiaoyang111222/cn-math-taxonomy contributors",
    "Modifications": [
      "Converted to learning-harness schema",
      "English translation"
    ],
    "Translation": {
      "status": "machine-translated",
      "humanReviewed": false,
      "model": "gpt-6.1-sol (xhigh)"
    },
    "LabelProvenance": "Domain from upstream category; provisional skill from upstream topic, not a formula-level judgment.",
    "Original": {
      "id": "cnm_h114_q3",
      "topicId": "cnm_h114",
      "difficulty": "standard",
      "type": "numeric",
      "prompt": "空间中两条相交直线的交点个数是多少？",
      "answer": "1",
      "explanation": "相交就是有且只有一个公共点。",
      "verify": "1"
    },
    "FigureSources": {},
    "Figures": []
  }
}
