{
  "ID": "cnm_h093_q3",
  "Bank": "cn-math",
  "SchemaVersion": "2.0",
  "Year": null,
  "Level": "High school required",
  "Grade": 11,
  "CurriculumUnit": "Required mathematics II",
  "Batch": "cnm_h093",
  "Number": 3,
  "Area": "Geometry",
  "domain": [
    "domain:geometry"
  ],
  "skill": [
    "skill:cn:cnm_h093"
  ],
  "Topic": {
    "id": "cnm_h093",
    "label": "Solving Triangles"
  },
  "Difficulty": "standard",
  "Language": "en",
  "ResponseType": "numeric",
  "Question Type": "text",
  "Choices Type": "text",
  "Question": "How many degrees is the sum of a triangle's interior angles?",
  "Choices": {},
  "Correct Answer": "180",
  "Accepted Answers": [],
  "Unordered Answers": false,
  "Solution": "The interior angles of a triangle sum to \\(180^\\circ\\). Thus the requested number of degrees is \\(180\\).",
  "Meta": {
    "SourceURL": "https://github.com/xiaoyang111222/cn-math-taxonomy",
    "SourceRevision": "62b341d4b66b175413d6e3f697e37639fd96aa2d",
    "SourceQuestionID": "cnm_h093_q3",
    "SourceTopicID": "cnm_h093",
    "SolutionSource": "cn-math-taxonomy (AI-generated; not teacher reviewed)",
    "License": "CC-BY-NC-4.0",
    "LicenseURL": "https://creativecommons.org/licenses/by-nc/4.0/",
    "Attribution": "xiaoyang111222/cn-math-taxonomy contributors",
    "Modifications": [
      "Converted to learning-harness schema",
      "English translation",
      "Reviewed question-quality corrections; pre-correction record and immutable sources preserved"
    ],
    "Translation": {
      "status": "machine-translated",
      "humanReviewed": false,
      "model": "gpt-6.1-sol (xhigh)"
    },
    "LabelProvenance": "Domain from upstream category; provisional skill from upstream topic, not a formula-level judgment.",
    "Original": {
      "id": "cnm_h093_q3",
      "topicId": "cnm_h093",
      "difficulty": "standard",
      "type": "numeric",
      "prompt": "三角形内角和是多少度？",
      "answer": "180",
      "explanation": "解三角形时，已知两角就可以用内角和求第三角。",
      "verify": "180"
    },
    "FigureSources": {},
    "Figures": [],
    "QualityCorrections": [
      {
        "revision": "quality-2026-10-21",
        "original": "curation/originals/cnm_h093_q3.json",
        "reason": "State the requested angle sum explicitly instead of only describing how it may be used.",
        "evidence": [
          "cnm_h093_q3:1"
        ]
      }
    ]
  }
}
