{
  "ID": "cnm_062_q4",
  "Bank": "cn-math",
  "SchemaVersion": "2.0",
  "Year": null,
  "Level": "Middle school",
  "Grade": 7,
  "CurriculumUnit": "Grade 7",
  "Batch": "cnm_062",
  "Number": 4,
  "Area": "Geometry",
  "domain": [
    "domain:geometry"
  ],
  "skill": [
    "skill:cn:cnm_062"
  ],
  "Topic": {
    "id": "cnm_062",
    "label": "Adjacent supplementary angles"
  },
  "Difficulty": "standard",
  "Language": "en",
  "ResponseType": "numeric",
  "Question Type": "text",
  "Choices Type": "text",
  "Question": "Among the four angles formed by two intersecting lines, how many linear pairs are there in total?",
  "Choices": {},
  "Correct Answer": "4",
  "Accepted Answers": [],
  "Unordered Answers": false,
  "Solution": "Each angle forms a linear pair with 2 other angles, giving \\(4\\times2\\div2=4\\) pairs.",
  "Meta": {
    "SourceURL": "https://github.com/xiaoyang111222/cn-math-taxonomy",
    "SourceRevision": "62b341d4b66b175413d6e3f697e37639fd96aa2d",
    "SourceQuestionID": "cnm_062_q4",
    "SourceTopicID": "cnm_062",
    "SolutionSource": "cn-math-taxonomy (AI-generated; not teacher reviewed)",
    "License": "CC-BY-NC-4.0",
    "LicenseURL": "https://creativecommons.org/licenses/by-nc/4.0/",
    "Attribution": "xiaoyang111222/cn-math-taxonomy contributors",
    "Modifications": [
      "Converted to learning-harness schema",
      "English translation"
    ],
    "Translation": {
      "status": "machine-translated",
      "humanReviewed": false,
      "model": "gpt-6.1-sol (xhigh)"
    },
    "LabelProvenance": "Domain from upstream category; provisional skill from upstream topic, not a formula-level judgment.",
    "Original": {
      "id": "cnm_062_q4",
      "topicId": "cnm_062",
      "difficulty": "standard",
      "type": "numeric",
      "prompt": "两直线相交所成的四个角中，共有几对邻补角？",
      "answer": "4",
      "explanation": "每个角有 2 个邻补角，4×2÷2=4 对。",
      "verify": "4*2//2"
    },
    "FigureSources": {},
    "Figures": []
  }
}
