{
  "ID": "cnm_210_q5",
  "Bank": "cn-math",
  "SchemaVersion": "2.0",
  "Year": null,
  "Level": "Middle school",
  "Grade": 8,
  "CurriculumUnit": "Grade 8",
  "Batch": "cnm_210",
  "Number": 5,
  "Area": "Modeling and mathematical practice",
  "domain": [
    "domain:modeling-practice"
  ],
  "skill": [
    "skill:cn:cnm_210"
  ],
  "Topic": {
    "id": "cnm_210",
    "label": "Synthesis and Practice: Music and Mathematics"
  },
  "Difficulty": "advanced",
  "Language": "en",
  "ResponseType": "numeric",
  "Question Type": "text",
  "Choices Type": "text",
  "Question": "Each time the pitch rises by one octave, the frequency becomes 2 times its original value. A tone has a frequency of 220 Hz. What is its frequency in Hz after it is raised by two octaves?",
  "Choices": {},
  "Correct Answer": "880",
  "Accepted Answers": [],
  "Unordered Answers": false,
  "Solution": "Raising the pitch by two octaves multiplies the frequency by 2 twice: $220\\times2\\times2=880$.",
  "Meta": {
    "SourceURL": "https://github.com/xiaoyang111222/cn-math-taxonomy",
    "SourceRevision": "62b341d4b66b175413d6e3f697e37639fd96aa2d",
    "SourceQuestionID": "cnm_210_q5",
    "SourceTopicID": "cnm_210",
    "SolutionSource": "cn-math-taxonomy (AI-generated; not teacher reviewed)",
    "License": "CC-BY-NC-4.0",
    "LicenseURL": "https://creativecommons.org/licenses/by-nc/4.0/",
    "Attribution": "xiaoyang111222/cn-math-taxonomy contributors",
    "Modifications": [
      "Converted to learning-harness schema",
      "English translation"
    ],
    "Translation": {
      "status": "machine-translated",
      "humanReviewed": false,
      "model": "gpt-6.1-sol (xhigh)"
    },
    "LabelProvenance": "Domain from upstream category; provisional skill from upstream topic, not a formula-level judgment.",
    "Original": {
      "id": "cnm_210_q5",
      "topicId": "cnm_210",
      "difficulty": "advanced",
      "type": "numeric",
      "prompt": "音高每升高一个八度，频率变为原来的 2 倍。某音的频率为 220 Hz，升高两个八度后频率是多少 Hz？",
      "answer": "880",
      "explanation": "升高两个八度，频率乘 2 两次：220×2×2=880。",
      "verify": "220*2**2"
    },
    "FigureSources": {},
    "Figures": []
  }
}
