{
  "ID": "cnm_p024_q3",
  "Bank": "cn-math",
  "SchemaVersion": "2.0",
  "Year": null,
  "Level": "Primary",
  "Grade": 1,
  "CurriculumUnit": "Grade 1",
  "Batch": "cnm_p024",
  "Number": 3,
  "Area": "Geometry",
  "domain": [
    "domain:geometry"
  ],
  "skill": [
    "skill:cn:cnm_p024"
  ],
  "Topic": {
    "id": "cnm_p024",
    "label": "Combining Plane Shapes"
  },
  "Difficulty": "standard",
  "Language": "en",
  "ResponseType": "numeric",
  "Question Type": "mixed",
  "Choices Type": "text",
  "Question": "Use 2 triangles and 1 square to make a picture. How many shapes are used altogether? Calculate: \\(2+1=?\\)\n\n[Figure 1](figures/cnm_p024_q3_question_en.svg)",
  "Choices": {},
  "Correct Answer": "3",
  "Accepted Answers": [],
  "Unordered Answers": false,
  "Solution": "\\(2+1=3\\).",
  "Meta": {
    "SourceURL": "https://github.com/xiaoyang111222/cn-math-taxonomy",
    "SourceRevision": "62b341d4b66b175413d6e3f697e37639fd96aa2d",
    "SourceQuestionID": "cnm_p024_q3",
    "SourceTopicID": "cnm_p024",
    "SolutionSource": "cn-math-taxonomy (AI-generated; not teacher reviewed)",
    "License": "CC-BY-NC-4.0",
    "LicenseURL": "https://creativecommons.org/licenses/by-nc/4.0/",
    "Attribution": "xiaoyang111222/cn-math-taxonomy contributors",
    "Modifications": [
      "Converted to learning-harness schema",
      "English translation",
      "Extracted upstream SVG figures; English labels translated and spaced, viewBox padded; diagram geometry unchanged"
    ],
    "Translation": {
      "status": "machine-translated",
      "humanReviewed": false,
      "model": "gpt-6.1-sol (xhigh)"
    },
    "LabelProvenance": "Domain from upstream category; provisional skill from upstream topic, not a formula-level judgment.",
    "Original": {
      "id": "cnm_p024_q3",
      "topicId": "cnm_p024",
      "difficulty": "standard",
      "type": "numeric",
      "prompt": "用 2 个三角形和 1 个正方形拼图。一共用了几个图形？计算：2＋1＝？",
      "answer": "3",
      "explanation": "2＋1＝3。",
      "verify": "2+1",
      "figure": "<svg xmlns=\"http://www.w3.org/2000/svg\" viewBox=\"0 0 250 130\"><polygon points=\"20,30 70,110 20,110\" fill=\"currentColor\" fill-opacity=\"0.12\" stroke=\"none\"/><polygon points=\"20,30 70,110 20,110\" fill=\"none\" stroke=\"currentColor\" stroke-width=\"2.4\" stroke-linejoin=\"round\" stroke-linecap=\"round\"/><polygon points=\"90,30 140,110 90,110\" fill=\"currentColor\" fill-opacity=\"0.12\" stroke=\"none\"/><polygon points=\"90,30 140,110 90,110\" fill=\"none\" stroke=\"currentColor\" stroke-width=\"2.4\" stroke-linejoin=\"round\" stroke-linecap=\"round\"/><rect x=\"160\" y=\"40\" width=\"70\" height=\"70\" fill=\"currentColor\" fill-opacity=\"0.12\" stroke=\"none\"/><rect x=\"160\" y=\"40\" width=\"70\" height=\"70\" fill=\"none\" stroke=\"currentColor\" stroke-width=\"2.4\" stroke-linejoin=\"round\" stroke-linecap=\"round\"/></svg>"
    },
    "FigureSources": {
      "figures/cnm_p024_q3_question_en.svg": {
        "url": "https://github.com/xiaoyang111222/cn-math-taxonomy/blob/62b341d4b66b175413d6e3f697e37639fd96aa2d/data/questions.json",
        "sourceQuestionID": "cnm_p024_q3",
        "sourcePointer": "/figure",
        "alt": "Combining Plane Shapes",
        "originalSHA256": "b0b0e222006d78c37129142df415b0fcd3a5b996600c7b1093eecb731e12ead4",
        "sha256": "fb57fcf16d7393b5fa3b44429a78668f6d45b664e5ea8a23e59cbfdf25e28e0f",
        "translatedLabels": {},
        "labelLayout": {},
        "viewBoxPadding": 24,
        "geometry": "Unchanged upstream SVG geometry"
      }
    },
    "Figures": [
      "figures/cnm_p024_q3_question_en.svg"
    ]
  }
}
